[
  {"id": "seed:baiterek", "name": "Монумент «Байтерек»", "lat": 51.1283, "lon": 71.4305, "category": "viewpoint", "tags": ["view", "photo", "landmark", "indoor"], "description": "Символ Астаны высотой 97 м со смотровой площадкой на высоте около 86 м.", "description_source": "manual", "address": "бульвар Нуржол", "opening_hours": null, "opening_hours_source": null, "opening_hours_checked_at": null, "phone": null, "website": null, "rating": 4.7, "rating_count": null, "popularity": 1.0, "indoor": true, "wheelchair": "limited", "kid_friendly": true, "price_level": 1, "typical_visit_min": 40, "sources": [{"name": "seed", "url": null, "fetched_at": "2026-10-20"}], "data_quality": 0.4, "updated_at": "2026-10-20"},
  {"id": "seed:khan_shatyr", "name": "ТРЦ «Хан Шатыр»", "lat": 51.1325, "lon": 71.4036, "category": "mall", "tags": ["indoor", "shopping", "kids", "family", "coffee"], "description": "Торгово-развлекательный центр в форме шатра с крытым пляжем и аттракционами.", "description_source": "manual", "address": "проспект Туран, 37", "opening_hours": "Mo-Su 10:00-22:00", "opening_hours_source": "manual", "opening_hours_checked_at": "2026-10-20", "phone": null, "website": null, "rating": 4.6, "rating_count": null, "popularity": 0.95, "indoor": true, "wheelchair": "yes", "kid_friendly": true, "price_level": 2, "typical_visit_min": 90, "sources": [{"name": "seed", "url": null, "fetched_at": "2026-10-20"}], "data_quality": 0.5, "updated_at": "2026-10-20"},
  {"id": "seed:mega_silk_way", "name": "ТРЦ «Mega Silk Way»", "lat": 51.0890, "lon": 71.4100, "category": "mall", "tags": ["indoor", "shopping", "kids", "family", "coffee", "cinema"], "description": "Крупный торговый центр рядом с территорией ЭКСПО, есть кинотеатр и фуд-корт.", "description_source": "manual", "address": "проспект Кабанбай батыра, 62", "opening_hours": "Mo-Su 10:00-22:00", "opening_hours_source": "manual", "opening_hours_checked_at": "2026-10-20", "phone": null, "website": null, "rating": 4.6, "rating_count": null, "popularity": 0.9, "indoor": true, "wheelchair": "yes", "kid_friendly": true, "price_level": 2, "typical_visit_min": 90, "sources": [{"name": "seed", "url": null, "fetched_at": "2026-10-20"}], "data_quality": 0.5, "updated_at": "2026-10-20"},
  {"id": "seed:nur_alem", "name": "Музей «Нур Алем» (ЭКСПО)", "lat": 51.0892, "lon": 71.4166, "category": "museum", "tags": ["interactive", "kids", "indoor", "science", "view", "unusual"], "description": "Сферический павильон ЭКСПО-2017, музей энергии будущего с интерактивными экспозициями.", "description_source": "manual", "address": "проспект Мангилик Ел, 53/1", "opening_hours": null, "opening_hours_source": null, "opening_hours_checked_at": null, "phone": null, "website": null, "rating": 4.8, "rating_count": null, "popularity": 0.9, "indoor": true, "wheelchair": "yes", "kid_friendly": true, "price_level": 2, "typical_visit_min": 90, "sources": [{"name": "seed", "url": null, "fetched_at": "2026-10-20"}], "data_quality": 0.4, "updated_at": "2026-10-20"},
  {"id": "seed:botanical_garden", "name": "Ботанический сад Астаны", "lat": 51.1090, "lon": 71.4170, "category": "park", "tags": ["outdoor", "walk", "quiet", "free", "family", "photo"], "description": "Большой парк с аллеями, прудом и оранжереей в южной части левого берега.", "description_source": "manual", "address": null, "opening_hours": null, "opening_hours_source": null, "opening_hours_checked_at": null, "phone": null, "website": null, "rating": 4.6, "rating_count": null, "popularity": 0.7, "indoor": false, "wheelchair": "yes", "kid_friendly": true, "price_level": 0, "typical_visit_min": 60, "sources": [{"name": "seed", "url": null, "fetched_at": "2026-10-20"}], "data_quality": 0.3, "updated_at": "2026-10-20"},
  {"id": "seed:ak_orda", "name": "Резиденция «Ак Орда» (вид с площади)", "lat": 51.1258, "lon": 71.4461, "category": "landmark", "tags": ["photo", "outdoor", "free", "architecture"], "description": "Президентский дворец с голубым куполом; осматривается снаружи с бульвара.", "description_source": "manual", "address": null, "opening_hours": null, "opening_hours_source": null, "opening_hours_checked_at": null, "phone": null, "website": null, "rating": 4.7, "rating_count": null, "popularity": 0.8, "indoor": false, "wheelchair": "yes", "kid_friendly": true, "price_level": 0, "typical_visit_min": 15, "sources": [{"name": "seed", "url": null, "fetched_at": "2026-10-20"}], "data_quality": 0.3, "updated_at": "2026-10-20"},
  {"id": "seed:palace_peace", "name": "Дворец мира и согласия (Пирамида)", "lat": 51.1228, "lon": 71.4637, "category": "landmark", "tags": ["architecture", "photo", "indoor", "unusual"], "description": "Здание-пирамида архитектора Нормана Фостера, проводятся экскурсии.", "description_source": "manual", "address": null, "opening_hours": null, "opening_hours_source": null, "opening_hours_checked_at": null, "phone": null, "website": null, "rating": 4.7, "rating_count": null, "popularity": 0.7, "indoor": true, "wheelchair": "limited", "kid_friendly": true, "price_level": 1, "typical_visit_min": 45, "sources": [{"name": "seed", "url": null, "fetched_at": "2026-10-20"}], "data_quality": 0.3, "updated_at": "2026-10-20"},
  {"id": "seed:hazret_sultan", "name": "Мечеть «Хазрет Султан»", "lat": 51.1256, "lon": 71.4715, "category": "religious", "tags": ["architecture", "photo", "free", "quiet"], "description": "Одна из крупнейших мечетей Центральной Азии; посещение со скромной одеждой.", "description_source": "manual", "address": null, "opening_hours": null, "opening_hours_source": null, "opening_hours_checked_at": null, "phone": null, "website": null, "rating": 4.9, "rating_count": null, "popularity": 0.8, "indoor": true, "wheelchair": "limited", "kid_friendly": true, "price_level": 0, "typical_visit_min": 30, "sources": [{"name": "seed", "url": null, "fetched_at": "2026-10-20"}], "data_quality": 0.3, "updated_at": "2026-10-20"},
  {"id": "seed:national_museum", "name": "Национальный музей Республики Казахстан", "lat": 51.1196, "lon": 71.4727, "category": "museum", "tags": ["history", "indoor", "kids", "interactive"], "description": "Крупнейший музей страны: история, этнография, «Золотой зал».", "description_source": "manual", "address": "проспект Тәуелсіздік, 54", "opening_hours": null, "opening_hours_source": null, "opening_hours_checked_at": null, "phone": null, "website": null, "rating": 4.8, "rating_count": null, "popularity": 0.8, "indoor": true, "wheelchair": "yes", "kid_friendly": true, "price_level": 1, "typical_visit_min": 90, "sources": [{"name": "seed", "url": null, "fetched_at": "2026-10-20"}], "data_quality": 0.3, "updated_at": "2026-10-20"},
  {"id": "seed:central_park", "name": "Центральный парк", "lat": 51.1530, "lon": 71.4185, "category": "park", "tags": ["outdoor", "walk", "kids", "playground", "free", "family"], "description": "Парк на правом берегу Есиля с аттракционами и детскими площадками.", "description_source": "manual", "address": null, "opening_hours": null, "opening_hours_source": null, "opening_hours_checked_at": null, "phone": null, "website": null, "rating": 4.5, "rating_count": null, "popularity": 0.7, "indoor": false, "wheelchair": "yes", "kid_friendly": true, "price_level": 0, "typical_visit_min": 60, "sources": [{"name": "seed", "url": null, "fetched_at": "2026-10-20"}], "data_quality": 0.3, "updated_at": "2026-10-20"},
  {"id": "seed:keruen", "name": "ТРЦ «Керуен»", "lat": 51.1292, "lon": 71.4246, "category": "mall", "tags": ["indoor", "coffee", "shopping"], "description": "Торговый центр у бульвара Нуржол рядом с Байтереком.", "description_source": "manual", "address": null, "opening_hours": "Mo-Su 10:00-22:00", "opening_hours_source": "manual", "opening_hours_checked_at": "2026-10-20", "phone": null, "website": null, "rating": 4.4, "rating_count": null, "popularity": 0.6, "indoor": true, "wheelchair": "yes", "kid_friendly": true, "price_level": 2, "typical_visit_min": 45, "sources": [{"name": "seed", "url": null, "fetched_at": "2026-10-20"}], "data_quality": 0.4, "updated_at": "2026-10-20"},
  {"id": "seed:nurzhol_boulevard", "name": "Бульвар Нуржол", "lat": 51.1270, "lon": 71.4330, "category": "landmark", "tags": ["outdoor", "walk", "free", "photo", "night", "view"], "description": "Центральная пешеходная ось левого берега от Хан Шатыра до Ак Орды, вечером с подсветкой.", "description_source": "manual", "address": null, "opening_hours": "24/7", "opening_hours_source": "manual", "opening_hours_checked_at": "2026-10-20", "phone": null, "website": null, "rating": null, "rating_count": null, "popularity": 0.8, "indoor": false, "wheelchair": "yes", "kid_friendly": true, "price_level": 0, "typical_visit_min": 40, "sources": [{"name": "seed", "url": null, "fetched_at": "2026-10-20"}], "data_quality": 0.4, "updated_at": "2026-10-20"},
  {"id": "seed:airport", "name": "Международный аэропорт Астаны", "lat": 51.0222, "lon": 71.4669, "category": "other", "tags": ["transport", "indoor"], "description": "Аэропорт имени Нурсултана Назарбаева; ~20–30 минут на машине до левого берега.", "description_source": "manual", "address": null, "opening_hours": "24/7", "opening_hours_source": "manual", "opening_hours_checked_at": "2026-10-20", "phone": null, "website": null, "rating": null, "rating_count": null, "popularity": 0.5, "indoor": true, "wheelchair": "yes", "kid_friendly": true, "price_level": null, "typical_visit_min": null, "sources": [{"name": "seed", "url": null, "fetched_at": "2026-10-20"}], "data_quality": 0.4, "updated_at": "2026-10-20"}
]
